{
  "schema_version": 1,
  "request_id": "55555555-5555-4555-8555-555555555555",
  "course_id": "33333333-3333-4333-8333-333333333333",
  "results": [
    {
      "lo_id": "77777777-7777-4777-8777-777777777777",
      "lo_code": "L.O.3.1",
      "bloom_level": 4,
      "quiz_items": [
        {
          "question": "Phân tích yêu cầu chức năng là gì?",
          "choices": ["Mô tả hệ thống", "Phân tích chức năng", "Thiết kế cơ sở dữ liệu", "Kiểm thử phần mềm"],
          "correct_index": 1,
          "explanation": "Phân tích yêu cầu chức năng xác định các chức năng hệ thống.",
          "difficulty": "medium",
          "lo_alignment_rationale": "Trực tiếp kiểm tra L.O.3.1.",
          "source_chunk_ids": ["11111111-1111-4111-8111-111111111111"],
          "model_id": "gemini/gemini-3-flash-preview"
        }
      ]
    },
    {
      "lo_id": "99999999-9999-4999-8999-999999999999",
      "lo_code": "L.O.3.3",
      "bloom_level": 2,
      "quiz_items": [
        {
          "question": "Chọn tất cả các yêu cầu phi chức năng.",
          "choices": ["Thời gian phản hồi dưới 2 giây", "Đặt lại mật khẩu qua email", "Mã hoá dữ liệu khi lưu", "Xuất báo cáo PDF"],
          "correct_indices": [0, 2],
          "explanation": "Theo slide chương 3.",
          "difficulty": "medium",
          "lo_alignment_rationale": "Kiểm tra L.O.3.3.",
          "source_chunk_ids": ["11111111-1111-4111-8111-111111111111"],
          "model_id": "gemini/gemini-3-flash-preview"
        },
        {
          "question": "Yêu cầu phi chức năng mô tả hệ thống phải làm gì.",
          "is_true": false,
          "explanation": "Theo slide chương 3.",
          "difficulty": "medium",
          "lo_alignment_rationale": "Kiểm tra L.O.3.3.",
          "source_chunk_ids": ["11111111-1111-4111-8111-111111111111"],
          "model_id": "gemini/gemini-3-flash-preview"
        },
        {
          "question": "Yêu cầu ____ mô tả hệ thống làm tốt đến mức nào.",
          "accepted_answers": ["phi chức năng", "non-functional"],
          "explanation": "Theo slide chương 3.",
          "difficulty": "medium",
          "lo_alignment_rationale": "Kiểm tra L.O.3.3.",
          "source_chunk_ids": ["11111111-1111-4111-8111-111111111111"],
          "model_id": "gemini/gemini-3-flash-preview"
        },
        {
          "question": "Vì sao yêu cầu hiệu năng là yêu cầu phi chức năng?",
          "model_answer": "Vì nó không thêm hành vi mới mà đặt ngưỡng chất lượng cho hành vi đã có.",
          "rubric": ["Không phải một hành vi/chức năng mới", "Là ngưỡng chất lượng của hệ thống"],
          "explanation": "Theo slide chương 3.",
          "difficulty": "medium",
          "lo_alignment_rationale": "Kiểm tra L.O.3.3.",
          "source_chunk_ids": ["11111111-1111-4111-8111-111111111111"],
          "model_id": "gemini/gemini-3-flash-preview"
        }
      ]
    },
    {
      "lo_id": "88888888-8888-4888-8888-888888888888",
      "lo_code": "L.O.3.2",
      "bloom_level": 2,
      "lesson_cards": [
        {
          "title": "Yêu cầu chức năng",
          "key_insight": "Yêu cầu chức năng mô tả hệ thống phải làm gì, không mô tả hệ thống tốt đến mức nào.",
          "bullets": [
            "Mỗi yêu cầu gắn với một hành vi người dùng quan sát được.",
            "Hiệu năng, bảo mật thuộc về yêu cầu phi chức năng."
          ],
          "example": "Người dùng đặt lại được mật khẩu qua email.",
          "misconception": null,
          "check_question": "Yêu cầu chức năng khác yêu cầu phi chức năng ở điểm nào?",
          "check_answer": "Chức năng mô tả hệ thống làm gì; phi chức năng mô tả hệ thống làm tốt đến mức nào.",
          "source_chunk_ids": ["11111111-1111-4111-8111-111111111111"],
          "model_id": "deepseek/deepseek-chat"
        }
      ]
    }
  ]
}
